{
  "title": "Service Unavailable",
  "status": 503,
  "detail": "A store the exchange needs cannot be reached; try again later.",
  "code": "SERVICE_UNAVAILABLE",
  "correlationId": "cccccccccccccccccccccccccccccccccccccccccccccccccccccccccccccccccccccccccccccccccccccccccccccccccccccccccccccccccccccccccccccccc"
}
